### ISSUE TITLE
使用代理玩日服公主连接，出现报错

### ISSUE THREAD

**Issue by kz-wind** [v2ray/v2ray-core#870]
Please skip to the English section below if you don't write Chinese.

中文：
提交 Issue 之前请先阅读 [Issue 指引](https://github.com/v2ray/v2ray-core/blob/master/.github/SUPPORT.md)，然后回答下面的问题，谢谢。
除非特殊情况，请完整填写所有问题。不按模板发的 issue 将直接被关闭。

1)  你正在使用哪个版本的 V2Ray？（如果服务器和客户端使用了不同版本，请注明）
客户端3.9 服务端3.9  安卓模拟器使用了0.3.10版本的v2rayNG
2)  你的使用场景是什么？比如使用 Chrome 通过 Socks/VMess 代理观看 YouTube 视频。
1.安卓模拟器直接使用v2rayNG登陆游戏
2.pc上使用 proxifier代理安卓模拟器登陆游戏
3)  你看到的不正常的现象是什么？（请描述具体现象，比如访问超时，TLS 证书错误等）
游戏提示无法登陆
4)  你期待看到的正确表现是怎样的？
可以正常登陆
5)  请附上你的配置（提交 Issue 前请隐藏服务器端IP地址）。
    
    服务器端配置:
```javascript
    // 在这里附上服务器端配置文件
```

    客户端配置:
```javascript
    // 在这里附上客户端配置
```

6)  请附上出错时软件输出的错误日志。在 Linux 中，日志通常在 `/var/log/v2ray/error.log` 文件中。

    服务器端错误日志:
```
    // 在这里附上服务器端日志
```
2018/02/17 15:06:56 [Debug]: App|DNS: returning 0 IPs for domain app.priconne-redive.jp.
2018/02/17 15:06:56 [Info]: App|Dispatcher: default route for tcp:app.priconne-redive.jp:443
2018/02/17 15:06:56 [Info]: Proxy|Freedom: opening connection to tcp:app.priconne-redive.jp:443
2018/02/17 15:06:56 [Info]: Transport|Internet|TCP: dialing TCP to tcp:app.priconne-redive.jp:443
2018/02/17 15:06:56 [Info]: App|Proxyman|Outbound: failed to process outbound traffic > Proxy|Freedom: connection ends > Proxy|Freedom: failed to process response > read tcp japan vps:54231->203.104.108.141:443: read: connection reset by peer
2018/02/17 15:07:04 [Info]: Transport|Internet|UDP: failed to handle UDP input > EOF
2018/02/17 15:07:04 [Info]: App|Proxyman|Outbound: failed to process outbound traffic > Proxy|Freedom: connection ends > context canceled
2018/02/17 15:07:06 [Info]: App|Proxyman|Mux: received request for tcp:203.104.108.141:443
2018/02/17 15:07:06 [Info]: App|Dispatcher: default route for tcp:203.104.108.141:443
2018/02/17 15:07:06 [Info]: Proxy|Freedom: opening connection to tcp:203.104.108.141:443
2018/02/17 15:07:06 [Info]: Transport|Internet|TCP: dialing TCP to tcp:203.104.108.141:443
2018/02/17 15:07:06 [Info]: App|Proxyman|Outbound: failed to process outbound traffic > Proxy|Freedom: connection ends > Proxy|Freedom: failed to process response > read tcp japan vps:54232->203.104.108.141:443: read: connection reset by peer

    客户端错误日志:
```
    // 在这里附上客户端日志
```
无错误日志
7) 请附上访问日志。在 Linux 中，日志通常在 `/var/log/v2ray/access.log` 文件中。
```
    // 在这里附上服务器端日志
```

8) 其它相关的配置文件（如 Nginx）和相关日志。

请预览一下你填的内容再提交。

如果你已经填完上面的问卷，请把下面的英文部份删除，再提交 Issue。

配置已经正常使用几个月了，所以就没贴了，目前没在其他地方遇到过这个问题，麻烦看一下什么问题，有没可能是游戏运营那边做了防代理等措施。

**Comment by DarienRaymond** [comment]
是不是这个游戏会发送什么非TCP/UDP的数据？如果只是TCP/UDP的话，应该是没有区别的

**Comment by kz-wind** [comment]
@DarienRaymond 你好，我今天用anyconnect尝试了成功连接时的抓包，麻烦你看一下，我去除了ssh/arp/dns后抓的所有类型的包了，从抓的内容来看，应该是没有其他特殊的包，不过我可以确定这个游戏厂商是做了某些防代理的措施。

19:01:25.634166 IP vpn-dhcp.56265 > ec2-52-193-110-16.ap-northeast-1.compute.amazonaws.com.https: Flags [S], seq 652336440, win 14600, options [mss 1460,sackOK,TS val 114686 ecr 0,nop,wscale 6], length 0
19:01:25.634184 IP 服务器.56265 > ec2-52-193-110-16.ap-northeast-1.compute.amazonaws.com.https: Flags [S], seq 652336440, win 14600, options [mss 1460,sackOK,TS val 114686 ecr 0,nop,wscale 6], length 0
19:01:25.739789 IP ec2-52-193-110-16.ap-northeast-1.compute.amazonaws.com.https > 服务器.56265: Flags [S.], seq 247508678, ack 652336441, win 26847, options [mss 1460,sackOK,TS val 40649901 ecr 114686,nop,wscale 8], length 0
19:01:25.739811 IP ec2-52-193-110-16.ap-northeast-1.compute.amazonaws.com.https > vpn-dhcp.56265: Flags [S.], seq 247508678, ack 652336441, win 26847, options [mss 1460,sackOK,TS val 40649901 ecr 114686,nop,wscale 8], length 0
19:01:25.739928 IP 服务器.https > 客户端.53631: UDP, length 125
19:01:25.798068 IP 客户端.53631 > 服务器.https: UDP, length 125
19:01:25.798171 IP vpn-dhcp.42673 > edge-star-shv-01-sjc3.facebook.com.https: Flags [S], seq 68518983, win 14600, options [mss 1460,sackOK,TS val 114703 ecr 0,nop,wscale 6], length 0
19:01:25.798192 IP 服务器.42673 > edge-star-shv-01-sjc3.facebook.com.https: Flags [S], seq 68518983, win 14600, options [mss 1460,sackOK,TS val 114703 ecr 0,nop,wscale 6], length 0
19:01:25.810409 IP edge-star-shv-01-sjc3.facebook.com.https > 服务器.42673: Flags [S.], seq 479230230, ack 68518984, win 27960, options [mss 1410,sackOK,TS val 3159665301 ecr 114703,nop,wscale 8], length 0
19:01:25.810432 IP edge-star-shv-01-sjc3.facebook.com.https > vpn-dhcp.42673: Flags [S.], seq 479230230, ack 68518984, win 27960, options [mss 1410,sackOK,TS val 3159665301 ecr 114703,nop,wscale 8], length 0
19:01:25.810507 IP 服务器.https > 客户端.53631: UDP, length 125
19:01:25.914406 IP 客户端.53631 > 服务器.https: UDP, length 109
19:01:25.914500 IP vpn-dhcp.56265 > ec2-52-193-110-16.ap-northeast-1.compute.amazonaws.com.https: Flags [.], ack 1, win 229, options [nop,nop,TS val 114714 ecr 40649901], length 0
19:01:25.914515 IP 服务器.56265 > ec2-52-193-110-16.ap-northeast-1.compute.amazonaws.com.https: Flags [.], ack 1, win 229, options [nop,nop,TS val 114714 ecr 40649901], length 0
19:01:25.918791 IP 客户端.53631 > 服务器.https: UDP, length 301
19:01:25.918865 IP vpn-dhcp.56265 > ec2-52-193-110-16.ap-northeast-1.compute.amazonaws.com.https: Flags [P.], seq 1:185, ack 1, win 229, options [nop,nop,TS val 114715 ecr 40649901], length 184
19:01:25.918877 IP 服务器.56265 > ec2-52-193-110-16.ap-northeast-1.compute.amazonaws.com.https: Flags [P.], seq 1:185, ack 1, win 229, options [nop,nop,TS val 114715 ecr 40649901], length 184
19:01:25.985012 IP 客户端.53631 > 服务器.https: UDP, length 109
19:01:25.985109 IP vpn-dhcp.42673 > edge-star-shv-01-sjc3.facebook.com.https: Flags [.], ack 1, win 229, options [nop,nop,TS val 114722 ecr 3159665301], length 0
19:01:25.985123 IP 服务器.42673 > edge-star-shv-01-sjc3.facebook.com.https: Flags [.], ack 1, win 229, options [nop,nop,TS val 114722 ecr 3159665301], length 0
19:01:25.985651 IP 客户端.53631 > 服务器.https: UDP, length 333
19:01:25.985758 IP vpn-dhcp.42673 > edge-star-shv-01-sjc3.facebook.com.https: Flags [P.], seq 1:216, ack 1, win 229, options [nop,nop,TS val 114722 ecr 3159665301], length 215
19:01:25.985770 IP 服务器.42673 > edge-star-shv-01-sjc3.facebook.com.https: Flags [P.], seq 1:216, ack 1, win 229, options [nop,nop,TS val 114722 ecr 3159665301], length 215
19:01:25.998020 IP edge-star-shv-01-sjc3.facebook.com.https > 服务器.42673: Flags [.], ack 216, win 114, options [nop,nop,TS val 3159665488 ecr 114722], length 0
19:01:25.998035 IP edge-star-shv-01-sjc3.facebook.com.https > vpn-dhcp.42673: Flags [.], ack 216, win 114, options [nop,nop,TS val 3159665488 ecr 114722], length 0
19:01:25.998136 IP 服务器.https > 客户端.53631: UDP, length 109
19:01:25.998720 IP edge-star-shv-01-sjc3.facebook.com.https > 服务器.42673: Flags [P.], seq 1:3172, ack 216, win 114, options [nop,nop,TS val 3159665489 ecr 114722], length 3171
19:01:25.998743 IP 服务器 > edge-star-shv-01-sjc3.facebook.com: ICMP 服务器 unreachable - need to frag (mtu 1406), length 556
19:01:26.011053 IP edge-star-shv-01-sjc3.facebook.com.https > 服务器.42673: Flags [.], seq 1:2797, ack 216, win 114, options [nop,nop,TS val 3159665501 ecr 114722], length 2796
19:01:26.011069 IP edge-star-shv-01-sjc3.facebook.com.https > vpn-dhcp.42673: Flags [.], seq 1:1355, ack 216, win 114, options [nop,nop,TS val 3159665501 ecr 114722], length 1354
19:01:26.011073 IP edge-star-shv-01-sjc3.facebook.com.https > vpn-dhcp.42673: Flags [.], seq 1355:2709, ack 216, win 114, options [nop,nop,TS val 3159665501 ecr 114722], length 1354
19:01:26.011075 IP edge-star-shv-01-sjc3.facebook.com.https > vpn-dhcp.42673: Flags [.], seq 2709:2797, ack 216, win 114, options [nop,nop,TS val 3159665501 ecr 114722], length 88
19:01:26.011168 IP 服务器.https > 客户端.53631: UDP, length 1469
19:01:26.011332 IP 服务器.https > 客户端.53631: UDP, length 1469
19:01:26.011471 IP 服务器.https > 客户端.53631: UDP, length 205
19:01:26.024577 IP ec2-52-193-110-16.ap-northeast-1.compute.amazonaws.com.https > 服务器.56265: Flags [.], ack 185, win 110, options [nop,nop,TS val 40649972 ecr 114715], length 0
19:01:26.024599 IP ec2-52-193-110-16.ap-northeast-1.compute.amazonaws.com.https > vpn-dhcp.56265: Flags [.], ack 185, win 110, options [nop,nop,TS val 40649972 ecr 114715], length 0
19:01:26.024690 IP 服务器.https > 客户端.53631: UDP, length 109
19:01:26.025877 IP ec2-52-193-110-16.ap-northeast-1.compute.amazonaws.com.https > 服务器.56265: Flags [P.], seq 1:2730, ack 185, win 110, options [nop,nop,TS val 40649972 ecr 114715], length 2729
19:01:26.025894 IP 服务器 > ec2-52-193-110-16.ap-northeast-1.compute.amazonaws.com: ICMP 服务器 unreachable - need to frag (mtu 1406), length 556
19:01:26.131275 IP ec2-52-193-110-16.ap-northeast-1.compute.amazonaws.com.https > 服务器.56265: Flags [.], seq 1:1449, ack 185, win 110, options [nop,nop,TS val 40649999 ecr 114715], length 1448
19:01:26.131312 IP ec2-52-193-110-16.ap-northeast-1.compute.amazonaws.com.https > vpn-dhcp.56265: Flags [.], seq 1:1355, ack 185, win 110, options [nop,nop,TS val 40649999 ecr 114715], length 1354
19:01:26.131324 IP ec2-52-193-110-16.ap-northeast-1.compute.amazonaws.com.https > vpn-dhcp.56265: Flags [.], seq 1355:1449, ack 185, win 110, options [nop,nop,TS val 40649999 ecr 114715], length 94
19:01:26.131480 IP 服务器.https > 客户端.53631: UDP, length 1469
19:01:26.131643 IP 服务器.https > 客户端.53631: UDP, length 205
19:01:26.185922 IP 客户端.53631 > 服务器.https: UDP, length 125
19:01:26.185968 IP 客户端.53631 > 服务器.https: UDP, length 125
19:01:26.185972 IP 客户端.53631 > 服务器.https: UDP, length 109
19:01:26.186088 IP vpn-dhcp.42673 > edge-star-shv-01-sjc3.facebook.com.https: Flags [.], ack 1, win 229, options [nop,nop,TS val 114742 ecr 3159665488,nop,nop,sack 1 {2709:2797}], length 0
19:01:26.186112 IP 服务器.42673 > edge-star-shv-01-sjc3.facebook.com.https: Flags [.], ack 1, win 229, options [nop,nop,TS val 114742 ecr 3159665488,nop,nop,sack 1 {2709:2797}], length 0
19:01:26.186230 IP vpn-dhcp.42673 > edge-star-shv-01-sjc3.facebook.com.https: Flags [.], ack 1355, win 274, options [nop,nop,TS val 114742 ecr 3159665501,nop,nop,sack 1 {2709:2797}], length 0
19:01:26.186239 IP 服务器.42673 > edge-star-shv-01-sjc3.facebook.com.https: Flags [.], ack 1355, win 274, options [nop,nop,TS val 114742 ecr 3159665501,nop,nop,sack 1 {2709:2797}], length 0
19:01:26.186339 IP vpn-dhcp.42673 > edge-star-shv-01-sjc3.facebook.com.https: Flags [.], ack 2797, win 319, options [nop,nop,TS val 114742 ecr 3159665501], length 0
19:01:26.186347 IP 服务器.42673 > edge-star-shv-01-sjc3.facebook.com.https: Flags [.], ack 2797, win 319, options [nop,nop,TS val 114742 ecr 3159665501], length 0
19:01:26.198442 IP edge-star-shv-01-sjc3.facebook.com.https > 服务器.42673: Flags [P.], seq 2797:3172, ack 216, win 114, options [nop,nop,TS val 3159665689 ecr 114742], length 375
19:01:26.198455 IP edge-star-shv-01-sjc3.facebook.com.https > vpn-dhcp.42673: Flags [P.], seq 2797:3172, ack 216, win 114, options [nop,nop,TS val 3159665689 ecr 114742], length 375
19:01:26.198555 IP 服务器.https > 客户端.53631: UDP, length 493
19:01:26.306094 IP 客户端.53631 > 服务器.https: UDP, length 125
19:01:26.306249 IP 客户端.53631 > 服务器.https: UDP, length 109
19:01:26.306356 IP vpn-dhcp.56265 > ec2-52-193-110-16.ap-northeast-1.compute.amazonaws.com.https: Flags [.], ack 1, win 229, options [nop,nop,TS val 114754 ecr 40649972,nop,nop,sack 1 {1355:1449}], length 0
19:01:26.306380 IP 服务器.56265 > ec2-52-193-110-16.ap-northeast-1.compute.amazonaws.com.https: Flags [.], ack 1, win 229, options [nop,nop,TS val 114754 ecr 40649972,nop,nop,sack 1 {1355:1449}], length 0
19:01:26.306539 IP vpn-dhcp.56265 > ec2-52-193-110-16.ap-northeast-1.compute.amazonaws.com.https: Flags [.], ack 1449, win 274, options [nop,nop,TS val 114754 ecr 40649999], length 0
19:01:26.306549 IP 服务器.56265 > ec2-52-193-110-16.ap-northeast-1.compute.amazonaws.com.https: Flags [.], ack 1449, win 274, options [nop,nop,TS val 114754 ecr 40649999], length 0
19:01:26.373947 IP 客户端.53631 > 服务器.https: UDP, length 109
19:01:26.374061 IP vpn-dhcp.42673 > edge-star-shv-01-sjc3.facebook.com.https: Flags [.], ack 3172, win 361, options [nop,nop,TS val 114760 ecr 3159665689], length 0
19:01:26.374078 IP 服务器.42673 > edge-star-shv-01-sjc3.facebook.com.https: Flags [.], ack 3172, win 361, options [nop,nop,TS val 114760 ecr 3159665689], length 0
19:01:26.411990 IP ec2-52-193-110-16.ap-northeast-1.compute.amazonaws.com.https > 服务器.56265: Flags [P.], seq 1449:2730, ack 185, win 110, options [nop,nop,TS val 40650069 ecr 114754], length 1281
19:01:26.412008 IP ec2-52-193-110-16.ap-northeast-1.compute.amazonaws.com.https > vpn-dhcp.56265: Flags [P.], seq 1449:2730, ack 185, win 110, options [nop,nop,TS val 40650069 ecr 114754], length 1281
19:01:26.412133 IP 服务器.https > 客户端.53631: UDP, length 1389
19:01:26.418424 IP 客户端.53631 > 服务器.https: UDP, length 237
19:01:26.418522 IP vpn-dhcp.42673 > edge-star-shv-01-sjc3.facebook.com.https: Flags [P.], seq 216:350, ack 3172, win 361, options [nop,nop,TS val 114765 ecr 3159665689], length 134
19:01:26.418534 IP 服务器.42673 > edge-star-shv-01-sjc3.facebook.com.https: Flags [P.], seq 216:350, ack 3172, win 361, options [nop,nop,TS val 114765 ecr 3159665689], length 134
19:01:26.431088 IP edge-star-shv-01-sjc3.facebook.com.https > 服务器.42673: Flags [P.], seq 3172:3438, ack 350, win 118, options [nop,nop,TS val 3159665921 ecr 114765], length 266
19:01:26.431100 IP edge-star-shv-01-sjc3.facebook.com.https > vpn-dhcp.42673: Flags [P.], seq 3172:3438, ack 350, win 118, options [nop,nop,TS val 3159665921 ecr 114765], length 266
19:01:26.431180 IP 服务器.https > 客户端.53631: UDP, length 381
19:01:26.586734 IP 客户端.53631 > 服务器.https: UDP, length 109
19:01:26.586854 IP vpn-dhcp.56265 > ec2-52-193-110-16.ap-northeast-1.compute.amazonaws.com.https: Flags [.], ack 2730, win 319, options [nop,nop,TS val 114782 ecr 40650069], length 0
19:01:26.586886 IP 服务器.56265 > ec2-52-193-110-16.ap-northeast-1.compute.amazonaws.com.https: Flags [.], ack 2730, win 319, options [nop,nop,TS val 114782 ecr 40650069], length 0
19:01:26.605022 IP 客户端.53631 > 服务器.https: UDP, length 109
19:01:26.605106 IP vpn-dhcp.42673 > edge-star-shv-01-sjc3.facebook.com.https: Flags [.], ack 3438, win 404, options [nop,nop,TS val 114784 ecr 3159665921], length 0
19:01:26.605118 IP 服务器.42673 > edge-star-shv-01-sjc3.facebook.com.https: Flags [.], ack 3438, win 404, options [nop,nop,TS val 114784 ecr 3159665921], length 0
19:01:26.611321 IP 客户端.53631 > 服务器.https: UDP, length 237
19:01:26.611333 IP 客户端.53631 > 服务器.https: UDP, length 557
19:01:26.611446 IP vpn-dhcp.56265 > ec2-52-193-110-16.ap-northeast-1.compute.amazonaws.com.https: Flags [P.], seq 185:319, ack 2730, win 319, options [nop,nop,TS val 114784 ecr 40650069], length 134
19:01:26.611458 IP 服务器.56265 > ec2-52-193-110-16.ap-northeast-1.compute.amazonaws.com.https: Flags [P.], seq 185:319, ack 2730, win 319, options [nop,nop,TS val 114784 ecr 40650069], length 134
19:01:26.611587 IP vpn-dhcp.42673 > edge-star-shv-01-sjc3.facebook.com.https: Flags [P.], seq 350:803, ack 3438, win 404, options [nop,nop,TS val 114784 ecr 3159665921], length 453
19:01:26.611596 IP 服务器.42673 > edge-star-shv-01-sjc3.facebook.com.https: Flags [P.], seq 350:803, ack 3438, win 404, options [nop,nop,TS val 114784 ecr 3159665921], length 453
19:01:26.650550 IP edge-star-shv-01-sjc3.facebook.com.https > 服务器.42673: Flags [P.], seq 3438:4387, ack 803, win 122, options [nop,nop,TS val 3159666141 ecr 114784], length 949
19:01:26.650572 IP edge-star-shv-01-sjc3.facebook.com.https > vpn-dhcp.42673: Flags [P.], seq 3438:4387, ack 803, win 122, options [nop,nop,TS val 3159666141 ecr 114784], length 949
19:01:26.650707 IP 服务器.https > 客户端.53631: UDP, length 1053
19:01:26.717365 IP ec2-52-193-110-16.ap-northeast-1.compute.amazonaws.com.https > 服务器.56265: Flags [P.], seq 2730:2789, ack 319, win 114, options [nop,nop,TS val 40650145 ecr 114784], length 59
19:01:26.717380 IP ec2-52-193-110-16.ap-northeast-1.compute.amazonaws.com.https > vpn-dhcp.56265: Flags [P.], seq 2730:2789, ack 319, win 114, options [nop,nop,TS val 40650145 ecr 114784], length 59
19:01:26.717484 IP 服务器.https > 客户端.53631: UDP, length 173
19:01:26.865370 IP 客户端.53631 > 服务器.https: UDP, length 109
19:01:26.865513 IP vpn-dhcp.42673 > edge-star-shv-01-sjc3.facebook.com.https: Flags [.], ack 4387, win 446, options [nop,nop,TS val 114810 ecr 3159666141], length 0
19:01:26.865544 IP 服务器.42673 > edge-star-shv-01-sjc3.facebook.com.https: Flags [.], ack 4387, win 446, options [nop,nop,TS val 114810 ecr 3159666141], length 0
19:01:26.893226 IP 客户端.53631 > 服务器.https: UDP, length 349
19:01:26.893333 IP 客户端.53631 > 服务器.https: UDP, length 1213
19:01:26.893385 IP vpn-dhcp.56265 > ec2-52-193-110-16.ap-northeast-1.compute.amazonaws.com.https: Flags [P.], seq 319:564, ack 2789, win 319, options [nop,nop,TS val 114812 ecr 40650145], length 245
19:01:26.893406 IP 服务器.56265 > ec2-52-193-110-16.ap-northeast-1.compute.amazonaws.com.https: Flags [P.], seq 319:564, ack 2789, win 319, options [nop,nop,TS val 114812 ecr 40650145], length 245
19:01:26.893532 IP vpn-dhcp.56265 > ec2-52-193-110-16.ap-northeast-1.compute.amazonaws.com.https: Flags [P.], seq 564:1673, ack 2789, win 319, options [nop,nop,TS val 114812 ecr 40650145], length 1109
19:01:26.893541 IP 服务器.56265 > ec2-52-193-110-16.ap-northeast-1.compute.amazonaws.com.https: Flags [P.], seq 564:1673, ack 2789, win 319, options [nop,nop,TS val 114812 ecr 40650145], length 1109
19:01:26.999141 IP ec2-52-193-110-16.ap-northeast-1.compute.amazonaws.com.https > 服务器.56265: Flags [.], ack 1673, win 127, options [nop,nop,TS val 40650216 ecr 114812], length 0
19:01:26.999164 IP ec2-52-193-110-16.ap-northeast-1.compute.amazonaws.com.https > vpn-dhcp.56265: Flags [.], ack 1673, win 127, options [nop,nop,TS val 40650216 ecr 114812], length 0
19:01:26.999285 IP 服务器.https > 客户端.53631: UDP, length 109
19:01:27.002091 IP ec2-52-193-110-16.ap-northeast-1.compute.amazonaws.com.https > 服务器.56265: Flags [P.], seq 2789:2938, ack 1673, win 127, options [nop,nop,TS val 40650216 ecr 114812], length 149
19:01:27.002103 IP ec2-52-193-110-16.ap-northeast-1.compute.amazonaws.com.https > vpn-dhcp.56265: Flags [P.], seq 2789:2938, ack 1673, win 127, options [nop,nop,TS val 40650216 ecr 114812], length 149
19:01:27.002176 IP 服务器.https > 客户端.53631: UDP, length 253
19:01:27.176821 IP 客户端.53631 > 服务器.https: UDP, length 141
19:01:27.176845 IP 客户端.53631 > 服务器.https: UDP, length 109
19:01:27.176996 IP vpn-dhcp.56265 > ec2-52-193-110-16.ap-northeast-1.compute.amazonaws.com.https: Flags [P.], seq 1673:1710, ack 2938, win 361, options [nop,nop,TS val 114841 ecr 40650216], length 37
19:01:27.177019 IP 服务器.56265 > ec2-52-193-110-16.ap-northeast-1.compute.amazonaws.com.https: Flags [P.], seq 1673:1710, ack 2938, win 361, options [nop,nop,TS val 114841 ecr 40650216], length 37
19:01:27.177156 IP vpn-dhcp.56265 > ec2-52-193-110-16.ap-northeast-1.compute.amazonaws.com.https: Flags [F.], seq 1710, ack 2938, win 361, options [nop,nop,TS val 114841 ecr 40650216], length 0
19:01:27.177165 IP 服务器.56265 > ec2-52-193-110-16.ap-northeast-1.compute.amazonaws.com.https: Flags [F.], seq 1710, ack 2938, win 361, options [nop,nop,TS val 114841 ecr 40650216], length 0
19:01:27.282702 IP ec2-52-193-110-16.ap-northeast-1.compute.amazonaws.com.https > 服务器.56265: Flags [P.], seq 2938:2975, ack 1710, win 127, options [nop,nop,TS val 40650286 ecr 114841], length 37
19:01:27.282725 IP ec2-52-193-110-16.ap-northeast-1.compute.amazonaws.com.https > vpn-dhcp.56265: Flags [P.], seq 2938:2975, ack 1710, win 127, options [nop,nop,TS val 40650286 ecr 114841], length 37
19:01:27.282734 IP ec2-52-193-110-16.ap-northeast-1.compute.amazonaws.com.https > 服务器.56265: Flags [F.], seq 2975, ack 1710, win 127, options [nop,nop,TS val 40650286 ecr 114841], length 0
19:01:27.282738 IP ec2-52-193-110-16.ap-northeast-1.compute.amazonaws.com.https > vpn-dhcp.56265: Flags [F.], seq 2975, ack 1710, win 127, options [nop,nop,TS val 40650286 ecr 114841], length 0
19:01:27.282740 IP ec2-52-193-110-16.ap-northeast-1.compute.amazonaws.com.https > 服务器.56265: Flags [.], ack 1711, win 127, options [nop,nop,TS val 40650286 ecr 114841], length 0
19:01:27.282743 IP ec2-52-193-110-16.ap-northeast-1.compute.amazonaws.com.https > vpn-dhcp.56265: Flags [.], ack 1711, win 127, options [nop,nop,TS val 40650286 ecr 114841], length 0
19:01:27.282873 IP 服务器.https > 客户端.53631: UDP, length 141
19:01:27.283036 IP 服务器.https > 客户端.53631: UDP, length 109
19:01:27.283142 IP 服务器.https > 客户端.53631: UDP, length 109
19:01:27.456995 IP 客户端.53631 > 服务器.https: UDP, length 93
19:01:27.457018 IP 客户端.53631 > 服务器.https: UDP, length 93
19:01:27.457147 IP vpn-dhcp.56265 > ec2-52-193-110-16.ap-northeast-1.compute.amazonaws.com.https: Flags [R], seq 652338150, win 0, length 0
19:01:27.457181 IP vpn-dhcp.56265 > ec2-52-193-110-16.ap-northeast-1.compute.amazonaws.com.https: Flags [R], seq 652338150, win 0, length 0
19:01:27.457303 IP vpn-dhcp.56265 > ec2-52-193-110-16.ap-northeast-1.compute.amazonaws.com.https: Flags [R], seq 652338151, win 0, length 0
19:01:27.457316 IP 服务器.56265 > ec2-52-193-110-16.ap-northeast-1.compute.amazonaws.com.https: Flags [R], seq 652338151, win 0, length 0
19:01:30.388242 IP 182.92.24.18.http > 服务器.36993: Flags [F.], seq 1082, ack 143, win 31, length 0
19:01:30.388274 IP 182.92.24.18.http > vpn-dhcp.36993: Flags [F.], seq 1082, ack 143, win 31, length 0
19:01:30.388423 IP 服务器.https > 客户端.53631: UDP, length 93
19:01:30.594852 IP 客户端.53631 > 服务器.https: UDP, length 93
19:01:30.594988 IP vpn-dhcp.36993 > 182.92.24.18.http: Flags [.], ack 1083, win 262, length 0
19:01:30.595013 IP 服务器.36993 > 182.92.24.18.http: Flags [.], ack 1083, win 262, length 0
19:01:35.921628 IP 客户端.53631 > 服务器.https: UDP, length 125
19:01:35.958362 IP 服务器.https > 客户端.53631: UDP, length 237
19:01:36.133845 IP 客户端.53631 > 服务器.https: UDP, length 125
19:01:36.134046 IP vpn-dhcp.46412 > ec2-54-178-233-203.ap-northeast-1.compute.amazonaws.com.https: Flags [S], seq 1549062394, win 14600, options [mss 1460,sackOK,TS val 115736 ecr 0,nop,wscale 6], length 0
19:01:36.134116 IP 服务器.46412 > ec2-54-178-233-203.ap-northeast-1.compute.amazonaws.com.https: Flags [S], seq 1549062394, win 14600, options [mss 1460,sackOK,TS val 115736 ecr 0,nop,wscale 6], length 0
19:01:36.246725 IP ec2-54-178-233-203.ap-northeast-1.compute.amazonaws.com.https > 服务器.46412: Flags [S.], seq 976324882, ack 1549062395, win 26847, options [mss 1460,sackOK,TS val 21063413 ecr 115736,nop,wscale 8], length 0
19:01:36.246758 IP ec2-54-178-233-203.ap-northeast-1.compute.amazonaws.com.https > vpn-dhcp.46412: Flags [S.], seq 976324882, ack 1549062395, win 26847, options [mss 1460,sackOK,TS val 21063413 ecr 115736,nop,wscale 8], length 0
19:01:36.246993 IP 服务器.https > 客户端.53631: UDP, length 125
19:01:36.422488 IP 客户端.53631 > 服务器.https: UDP, length 109
19:01:36.422514 IP 客户端.53631 > 服务器.https: UDP, length 333
19:01:36.422634 IP vpn-dhcp.46412 > ec2-54-178-233-203.ap-northeast-1.compute.amazonaws.com.https: Flags [.], ack 1, win 229, options [nop,nop,TS val 115765 ecr 21063413], length 0
19:01:36.422659 IP 服务器.46412 > ec2-54-178-233-203.ap-northeast-1.compute.amazonaws.com.https: Flags [.], ack 1, win 229, options [nop,nop,TS val 115765 ecr 21063413], length 0
19:01:36.422811 IP vpn-dhcp.46412 > ec2-54-178-233-203.ap-northeast-1.compute.amazonaws.com.https: Flags [P.], seq 1:219, ack 1, win 229, options [nop,nop,TS val 115765 ecr 21063413], length 218
19:01:36.422820 IP 服务器.46412 > ec2-54-178-233-203.ap-northeast-1.compute.amazonaws.com.https: Flags [P.], seq 1:219, ack 1, win 229, options [nop,nop,TS val 115765 ecr 21063413], length 218
19:01:36.535381 IP ec2-54-178-233-203.ap-northeast-1.compute.amazonaws.com.https > 服务器.46412: Flags [.], ack 219, win 110, options [nop,nop,TS val 21063486 ecr 115765], length 0
19:01:36.535408 IP ec2-54-178-233-203.ap-northeast-1.compute.amazonaws.com.https > vpn-dhcp.46412: Flags [.], ack 219, win 110, options [nop,nop,TS val 21063486 ecr 115765], length 0
19:01:36.535531 IP 服务器.https > 客户端.53631: UDP, length 109
19:01:36.536800 IP ec2-54-178-233-203.ap-northeast-1.compute.amazonaws.com.https > 服务器.46412: Flags [P.], seq 1:4094, ack 219, win 110, options [nop,nop,TS val 21063486 ecr 115765], length 4093
19:01:36.536821 IP 服务器 > ec2-54-178-233-203.ap-northeast-1.compute.amazonaws.com: ICMP 服务器 unreachable - need to frag (mtu 1406), length 556
19:01:36.649577 IP ec2-54-178-233-203.ap-northeast-1.compute.amazonaws.com.https > 服务器.46412: Flags [.], seq 1:1449, ack 219, win 110, options [nop,nop,TS val 21063514 ecr 115765], length 1448
19:01:36.649620 IP ec2-54-178-233-203.ap-northeast-1.compute.amazonaws.com.https > vpn-dhcp.46412: Flags [.], seq 1:1355, ack 219, win 110, options [nop,nop,TS val 21063514 ecr 115765], length 1354
19:01:36.649630 IP ec2-54-178-233-203.ap-northeast-1.compute.amazonaws.com.https > vpn-dhcp.46412: Flags [.], seq 1355:1449, ack 219, win 110, options [nop,nop,TS val 21063514 ecr 115765], length 94
19:01:36.649634 IP ec2-54-178-233-203.ap-northeast-1.compute.amazonaws.com.https > 服务器.46412: Flags [.], seq 1449:2897, ack 219, win 110, options [nop,nop,TS val 21063514 ecr 115765], length 1448
19:01:36.649641 IP ec2-54-178-233-203.ap-northeast-1.compute.amazonaws.com.https > vpn-dhcp.46412: Flags [.], seq 1449:2803, ack 219, win 110, options [nop,nop,TS val 21063514 ecr 115765], length 1354
19:01:36.649642 IP ec2-54-178-233-203.ap-northeast-1.compute.amazonaws.com.https > vpn-dhcp.46412: Flags [.], seq 2803:2897, ack 219, win 110, options [nop,nop,TS val 21063514 ecr 115765], length 94
19:01:36.649812 IP 服务器.https > 客户端.53631: UDP, length 1469
19:01:36.649941 IP 服务器.https > 客户端.53631: UDP, length 205
19:01:36.650064 IP 服务器.https > 客户端.53631: UDP, length 1469
19:01:36.650120 IP 服务器.https > 客户端.53631: UDP, length 205
19:01:36.824419 IP 客户端.53631 > 服务器.https: UDP, length 125
19:01:36.824446 IP 客户端.53631 > 服务器.https: UDP, length 125
19:01:36.824448 IP 客户端.53631 > 服务器.https: UDP, length 125
19:01:36.824451 IP 客户端.53631 > 服务器.https: UDP, length 109
19:01:36.824577 IP vpn-dhcp.46412 > ec2-54-178-233-203.ap-northeast-1.compute.amazonaws.com.https: Flags [.], ack 1, win 229, options [nop,nop,TS val 115805 ecr 21063486,nop,nop,sack 1 {1355:1449}], length 0
19:01:36.824612 IP 服务器.46412 > ec2-54-178-233-203.ap-northeast-1.compute.amazonaws.com.https: Flags [.], ack 1, win 229, options [nop,nop,TS val 115805 ecr 21063486,nop,nop,sack 1 {1355:1449}], length 0
19:01:36.824770 IP vpn-dhcp.46412 > ec2-54-178-233-203.ap-northeast-1.compute.amazonaws.com.https: Flags [.], ack 1, win 229, options [nop,nop,TS val 115806 ecr 21063486,nop,nop,sack 2 {2803:2897}{1355:1449}], length 0
19:01:36.824779 IP 服务器.46412 > ec2-54-178-233-203.ap-northeast-1.compute.amazonaws.com.https: Flags [.], ack 1, win 229, options [nop,nop,TS val 115806 ecr 21063486,nop,nop,sack 2 {2803:2897}{1355:1449}], length 0
19:01:36.824881 IP vpn-dhcp.46412 > ec2-54-178-233-203.ap-northeast-1.compute.amazonaws.com.https: Flags [.], ack 1449, win 274, options [nop,nop,TS val 115806 ecr 21063514,nop,nop,sack 1 {2803:2897}], length 0
19:01:36.824890 IP 服务器.46412 > ec2-54-178-233-203.ap-northeast-1.compute.amazonaws.com.https: Flags [.], ack 1449, win 274, options [nop,nop,TS val 115806 ecr 21063514,nop,nop,sack 1 {2803:2897}], length 0
19:01:36.824940 IP vpn-dhcp.46412 > ec2-54-178-233-203.ap-northeast-1.compute.amazonaws.com.https: Flags [.], ack 2897, win 319, options [nop,nop,TS val 115806 ecr 21063514], length 0
19:01:36.824988 IP 服务器.46412 > ec2-54-178-233-203.ap-northeast-1.compute.amazonaws.com.https: Flags [.], ack 2897, win 319, options [nop,nop,TS val 115806 ecr 21063514], length 0
19:01:36.937564 IP ec2-54-178-233-203.ap-northeast-1.compute.amazonaws.com.https > 服务器.46412: Flags [P.], seq 2897:4094, ack 219, win 110, options [nop,nop,TS val 21063586 ecr 115806], length 1197
19:01:36.937595 IP ec2-54-178-233-203.ap-northeast-1.compute.amazonaws.com.https > vpn-dhcp.46412: Flags [P.], seq 2897:4094, ack 219, win 110, options [nop,nop,TS val 21063586 ecr 115806], length 1197
19:01:36.937784 IP 服务器.https > 客户端.53631: UDP, length 1309
19:01:37.112171 IP 客户端.53631 > 服务器.https: UDP, length 109
19:01:37.112299 IP vpn-dhcp.46412 > ec2-54-178-233-203.ap-northeast-1.compute.amazonaws.com.https: Flags [.], ack 4094, win 364, options [nop,nop,TS val 115834 ecr 21063586], length 0
19:01:37.112323 IP 服务器.46412 > ec2-54-178-233-203.ap-northeast-1.compute.amazonaws.com.https: Flags [.], ack 4094, win 364, options [nop,nop,TS val 115834 ecr 21063586], length 0
19:01:37.131336 IP 客户端.53631 > 服务器.https: UDP, length 237
19:01:37.131421 IP vpn-dhcp.46412 > ec2-54-178-233-203.ap-northeast-1.compute.amazonaws.com.https: Flags [P.], seq 219:353, ack 4094, win 364, options [nop,nop,TS val 115836 ecr 21063586], length 134
19:01:37.131432 IP 服务器.46412 > ec2-54-178-233-203.ap-northeast-1.compute.amazonaws.com.https: Flags [P.], seq 219:353, ack 4094, win 364, options [nop,nop,TS val 115836 ecr 21063586], length 134
19:01:37.244249 IP ec2-54-178-233-203.ap-northeast-1.compute.amazonaws.com.https > 服务器.46412: Flags [P.], seq 4094:4153, ack 353, win 114, options [nop,nop,TS val 21063663 ecr 115836], length 59
19:01:37.244279 IP ec2-54-178-233-203.ap-northeast-1.compute.amazonaws.com.https > vpn-dhcp.46412: Flags [P.], seq 4094:4153, ack 353, win 114, options [nop,nop,TS val 21063663 ecr 115836], length 59
19:01:37.244417 IP 服务器.https > 客户端.53631: UDP, length 173
19:01:37.426484 IP 客户端.53631 > 服务器.https: UDP, length 1117
19:01:37.426638 IP vpn-dhcp.46412 > ec2-54-178-233-203.ap-northeast-1.compute.amazonaws.com.https: Flags [P.], seq 353:1366, ack 4153, win 364, options [nop,nop,TS val 115866 ecr 21063663], length 1013
19:01:37.426693 IP 服务器.46412 > ec2-54-178-233-203.ap-northeast-1.compute.amazonaws.com.https: Flags [P.], seq 353:1366, ack 4153, win 364, options [nop,nop,TS val 115866 ecr 21063663], length 1013
19:01:37.578837 IP ec2-54-178-233-203.ap-northeast-1.compute.amazonaws.com.https > 服务器.46412: Flags [.], ack 1366, win 122, options [nop,nop,TS val 21063747 ecr 115866], length 0
19:01:37.578864 IP ec2-54-178-233-203.ap-northeast-1.compute.amazonaws.com.https > vpn-dhcp.46412: Flags [.], ack 1366, win 122, options [nop,nop,TS val 21063747 ecr 115866], length 0
19:01:37.579003 IP 服务器.https > 客户端.53631: UDP, length 109
19:01:37.743122 IP ec2-54-178-233-203.ap-northeast-1.compute.amazonaws.com.https > 服务器.46412: Flags [P.], seq 4153:4366, ack 1366, win 122, options [nop,nop,TS val 21063788 ecr 115866], length 213
19:01:37.743150 IP ec2-54-178-233-203.ap-northeast-1.compute.amazonaws.com.https > vpn-dhcp.46412: Flags [P.], seq 4153:4366, ack 1366, win 122, options [nop,nop,TS val 21063788 ecr 115866], length 213
19:01:37.743298 IP 服务器.https > 客户端.53631: UDP, length 317
19:01:37.955805 IP 客户端.53631 > 服务器.https: UDP, length 109
19:01:37.955953 IP vpn-dhcp.46412 > ec2-54-178-233-203.ap-northeast-1.compute.amazonaws.com.https: Flags [.], ack 4366, win 407, options [nop,nop,TS val 115919 ecr 21063788], length 0
19:01:37.955978 IP 服务器.46412 > ec2-54-178-233-203.ap-northeast-1.compute.amazonaws.com.https: Flags [.], ack 4366, win 407, options [nop,nop,TS val 115919 ecr 21063788], length 0
19:01:39.020220 IP 客户端.53631 > 服务器.https: UDP, length 125
19:01:39.031728 IP 服务器.https > 客户端.53631: UDP, length 141
19:01:39.209692 IP 客户端.53631 > 服务器.https: UDP, length 125
19:01:39.209808 IP vpn-dhcp.42467 > 203-104-108-141.data-hotel.net.https: Flags [S], seq 2352488860, win 14600, options [mss 1460,sackOK,TS val 116044 ecr 0,nop,wscale 6], length 0
19:01:39.209834 IP 服务器.42467 > 203-104-108-141.data-hotel.net.https: Flags [S], seq 2352488860, win 14600, options [mss 1460,sackOK,TS val 116044 ecr 0,nop,wscale 6], length 0
19:01:39.353179 IP 203-104-108-141.data-hotel.net.https > 服务器.42467: Flags [S.], seq 352053814, ack 2352488861, win 4380, options [mss 1366,nop,nop,TS val 3951379597 ecr 116044,sackOK,eol], length 0
19:01:39.353205 IP 203-104-108-141.data-hotel.net.https > vpn-dhcp.42467: Flags [S.], seq 352053814, ack 2352488861, win 4380, options [mss 1366,nop,nop,TS val 3951379597 ecr 116044,sackOK,eol], length 0
19:01:39.353402 IP 服务器.https > 客户端.53631: UDP, length 125
19:01:39.526724 IP 客户端.53631 > 服务器.https: UDP, length 109
19:01:39.526861 IP vpn-dhcp.42467 > 203-104-108-141.data-hotel.net.https: Flags [.], ack 1, win 14600, options [nop,nop,TS val 116076 ecr 3951379597], length 0
19:01:39.526886 IP 服务器.42467 > 203-104-108-141.data-hotel.net.https: Flags [.], ack 1, win 14600, options [nop,nop,TS val 116076 ecr 3951379597], length 0
19:01:39.527958 IP 客户端.53631 > 服务器.https: UDP, length 365
19:01:39.528056 IP vpn-dhcp.42467 > 203-104-108-141.data-hotel.net.https: Flags [P.], seq 1:258, ack 1, win 14600, options [nop,nop,TS val 116076 ecr 3951379597], length 257
19:01:39.528069 IP 服务器.42467 > 203-104-108-141.data-hotel.net.https: Flags [P.], seq 1:258, ack 1, win 14600, options [nop,nop,TS val 116076 ecr 3951379597], length 257
19:01:39.671179 IP 203-104-108-141.data-hotel.net.https > 服务器.42467: Flags [.], ack 258, win 4355, options [nop,nop,TS val 3951379916 ecr 116076], length 0
19:01:39.671206 IP 203-104-108-141.data-hotel.net.https > vpn-dhcp.42467: Flags [.], ack 258, win 4355, options [nop,nop,TS val 3951379916 ecr 116076], length 0
19:01:39.671335 IP 服务器.https > 客户端.53631: UDP, length 109
19:01:39.672180 IP 203-104-108-141.data-hotel.net.https > 服务器.42467: Flags [P.], seq 1:3405, ack 258, win 4355, options [nop,nop,TS val 3951379916 ecr 116076], length 3404
19:01:39.672199 IP 203-104-108-141.data-hotel.net.https > vpn-dhcp.42467: Flags [.], seq 1:1355, ack 258, win 4355, options [nop,nop,TS val 3951379916 ecr 116076], length 1354
19:01:39.672203 IP 203-104-108-141.data-hotel.net.https > vpn-dhcp.42467: Flags [.], seq 1355:2709, ack 258, win 4355, options [nop,nop,TS val 3951379916 ecr 116076], length 1354
19:01:39.672205 IP 203-104-108-141.data-hotel.net.https > vpn-dhcp.42467: Flags [P.], seq 2709:3405, ack 258, win 4355, options [nop,nop,TS val 3951379916 ecr 116076], length 696
19:01:39.672292 IP 服务器.https > 客户端.53631: UDP, length 1469
19:01:39.672433 IP 服务器.https > 客户端.53631: UDP, length 1469
19:01:39.672555 IP 服务器.https > 客户端.53631: UDP, length 813
19:01:39.846669 IP 客户端.53631 > 服务器.https: UDP, length 125
19:01:39.846699 IP 客户端.53631 > 服务器.https: UDP, length 125
19:01:39.846705 IP 客户端.53631 > 服务器.https: UDP, length 109
19:01:39.846841 IP vpn-dhcp.42467 > 203-104-108-141.data-hotel.net.https: Flags [.], ack 1, win 14600, options [nop,nop,TS val 116108 ecr 3951379916,nop,nop,sack 1 {2709:3405}], length 0
19:01:39.846869 IP 服务器.42467 > 203-104-108-141.data-hotel.net.https: Flags [.], ack 1, win 14600, options [nop,nop,TS val 116108 ecr 3951379916,nop,nop,sack 1 {2709:3405}], length 0
19:01:39.846996 IP vpn-dhcp.42467 > 203-104-108-141.data-hotel.net.https: Flags [.], ack 1355, win 16248, options [nop,nop,TS val 116108 ecr 3951379916,nop,nop,sack 1 {2709:3405}], length 0
19:01:39.847006 IP 服务器.42467 > 203-104-108-141.data-hotel.net.https: Flags [.], ack 1355, win 16248, options [nop,nop,TS val 116108 ecr 3951379916,nop,nop,sack 1 {2709:3405}], length 0
19:01:39.847107 IP vpn-dhcp.42467 > 203-104-108-141.data-hotel.net.https: Flags [.], ack 3405, win 20310, options [nop,nop,TS val 116108 ecr 3951379916], length 0
19:01:39.847115 IP 服务器.42467 > 203-104-108-141.data-hotel.net.https: Flags [.], ack 3405, win 20310, options [nop,nop,TS val 116108 ecr 3951379916], length 0
19:01:39.861912 IP 客户端.53631 > 服务器.https: UDP, length 317
19:01:39.862049 IP vpn-dhcp.42467 > 203-104-108-141.data-hotel.net.https: Flags [P.], seq 258:472, ack 3405, win 20310, options [nop,nop,TS val 116109 ecr 3951379916], length 214
19:01:39.862065 IP 服务器.42467 > 203-104-108-141.data-hotel.net.https: Flags [P.], seq 258:472, ack 3405, win 20310, options [nop,nop,TS val 116109 ecr 3951379916], length 214
19:01:40.005195 IP 203-104-108-141.data-hotel.net.https > 服务器.42467: Flags [.], ack 472, win 4569, options [nop,nop,TS val 3951380250 ecr 116109], length 0
19:01:40.005228 IP 203-104-108-141.data-hotel.net.https > vpn-dhcp.42467: Flags [.], ack 472, win 4569, options [nop,nop,TS val 3951380250 ecr 116109], length 0
19:01:40.005386 IP 服务器.https > 客户端.53631: UDP, length 109
19:01:40.005828 IP 203-104-108-141.data-hotel.net.https > 服务器.42467: Flags [P.], seq 3405:3411, ack 472, win 4569, options [nop,nop,TS val 3951380250 ecr 116109], length 6
19:01:40.005840 IP 203-104-108-141.data-hotel.net.https > vpn-dhcp.42467: Flags [P.], seq 3405:3411, ack 472, win 4569, options [nop,nop,TS val 3951380250 ecr 116109], length 6
19:01:40.005981 IP 203-104-108-141.data-hotel.net.https > 服务器.42467: Flags [P.], seq 3411:3480, ack 472, win 4569, options [nop,nop,TS val 3951380250 ecr 116109], length 69
19:01:40.005990 IP 203-104-108-141.data-hotel.net.https > vpn-dhcp.42467: Flags [P.], seq 3411:3480, ack 472, win 4569, options [nop,nop,TS val 3951380250 ecr 116109], length 69
19:01:40.006070 IP 服务器.https > 客户端.53631: UDP, length 109
19:01:40.006231 IP 服务器.https > 客户端.53631: UDP, length 173
19:01:40.180889 IP 客户端.53631 > 服务器.https: UDP, length 109
19:01:40.181047 IP vpn-dhcp.42467 > 203-104-108-141.data-hotel.net.https: Flags [.], ack 3480, win 20310, options [nop,nop,TS val 116141 ecr 3951380250], length 0
19:01:40.181072 IP 服务器.42467 > 203-104-108-141.data-hotel.net.https: Flags [.], ack 3480, win 20310, options [nop,nop,TS val 116141 ecr 3951380250], length 0
19:01:40.185312 IP 客户端.53631 > 服务器.https: UDP, length 1181
19:01:40.185410 IP vpn-dhcp.42467 > 203-104-108-141.data-hotel.net.https: Flags [P.], seq 472:1549, ack 3480, win 20310, options [nop,nop,TS val 116142 ecr 3951380250], length 1077
19:01:40.185422 IP 服务器.42467 > 203-104-108-141.data-hotel.net.https: Flags [P.], seq 472:1549, ack 3480, win 20310, options [nop,nop,TS val 116142 ecr 3951380250], length 1077
19:01:40.328571 IP 203-104-108-141.data-hotel.net.https > 服务器.42467: Flags [.], ack 1549, win 5646, options [nop,nop,TS val 3951380573 ecr 116142], length 0
19:01:40.328646 IP 203-104-108-141.data-hotel.net.https > vpn-dhcp.42467: Flags [.], ack 1549, win 5646, options [nop,nop,TS val 3951380573 ecr 116142], length 0
19:01:40.328820 IP 服务器.https > 客户端.53631: UDP, length 109
19:01:40.338899 IP 203-104-108-141.data-hotel.net.https > 服务器.42467: Flags [P.], seq 3480:4029, ack 1549, win 5646, options [nop,nop,TS val 3951380583 ecr 116142], length 549
19:01:40.338911 IP 203-104-108-141.data-hotel.net.https > vpn-dhcp.42467: Flags [P.], seq 3480:4029, ack 1549, win 5646, options [nop,nop,TS val 3951380583 ecr 116142], length 549
19:01:40.338918 IP 203-104-108-141.data-hotel.net.https > 服务器.42467: Flags [F.], seq 4029, ack 1549, win 5646, options [nop,nop,TS val 3951380583 ecr 116142], length 0
19:01:40.338922 IP 203-104-108-141.data-hotel.net.https > vpn-dhcp.42467: Flags [F.], seq 4029, ack 1549, win 5646, options [nop,nop,TS val 3951380583 ecr 116142], length 0
19:01:40.339000 IP 服务器.https > 客户端.53631: UDP, length 653
19:01:40.339120 IP 服务器.https > 客户端.53631: UDP, length 109
19:01:40.514513 IP 客户端.53631 > 服务器.https: UDP, length 157
19:01:40.514533 IP 客户端.53631 > 服务器.https: UDP, length 109
19:01:40.514725 IP vpn-dhcp.42467 > 203-104-108-141.data-hotel.net.https: Flags [P.], seq 1549:1602, ack 4030, win 23018, options [nop,nop,TS val 116175 ecr 3951380583], length 53
19:01:40.514747 IP 服务器.42467 > 203-104-108-141.data-hotel.net.https: Flags [P.], seq 1549:1602, ack 4030, win 23018, options [nop,nop,TS val 116175 ecr 3951380583], length 53
19:01:40.514866 IP vpn-dhcp.42467 > 203-104-108-141.data-hotel.net.https: Flags [F.], seq 1602, ack 4030, win 23018, options [nop,nop,TS val 116175 ecr 3951380583], length 0
19:01:40.514875 IP 服务器.42467 > 203-104-108-141.data-hotel.net.https: Flags [F.], seq 1602, ack 4030, win 23018, options [nop,nop,TS val 116175 ecr 3951380583], length 0
19:01:40.657809 IP 203-104-108-141.data-hotel.net.https > 服务器.42467: Flags [.], ack 1602, win 5699, options [nop,nop,TS val 3951380902 ecr 116175], length 0
19:01:40.657837 IP 203-104-108-141.data-hotel.net.https > vpn-dhcp.42467: Flags [.], ack 1602, win 5699, options [nop,nop,TS val 3951380902 ecr 116175], length 0
19:01:40.657848 IP 203-104-108-141.data-hotel.net.https > 服务器.42467: Flags [.], ack 1603, win 5699, options [nop,nop,TS val 3951380902 ecr 116175], length 0
19:01:40.657852 IP 203-104-108-141.data-hotel.net.https > vpn-dhcp.42467: Flags [.], ack 1603, win 5699, options [nop,nop,TS val 3951380902 ecr 116175], length 0
19:01:40.658033 IP 服务器.https > 客户端.53631: UDP, length 109
19:01:40.658179 IP 服务器.https > 客户端.53631: UDP, length 109

**Comment by BenhoNNNN** [comment]
如果要做某程序（适用模拟器）的代理规则，应该先确保程序所使用的所有进程名都添加进了 Proxifier 的规则里；以 PC 下使用 Proxifier 的经验来看，很多程序有不管主进程，很多组件进程都会发生网络通信的。

**Comment by kz-wind** [comment]
@BenhoNNNN 是这样的，我用了两种方式来做这个测试，一种是直接模拟器使用v2rayNG，另一种就是我提到的proxifier，但是两种使用下来的效果其实并没有区别，从日志上来看就是连接被重置了，所以我觉得是否是v2ray少转发了某些包导致认证不通过，然后连接就被重置了

**Comment by BenhoNNNN** [comment]
@kz-wind  先不开其他的程序，试试 Proxifier 全局劫持系统呢？

另外默认规则别删除，偶尔有些程序（特别是游戏）会内建回环地址通信。
`localhost; 127.0.0.1; %ComputerName% via Direct`

**Comment by kz-wind** [comment]
@BenhoNNNN 我觉得跟proxifier应该没多大关系，我之前尝试代理过其他日服的客户端游戏，都是能成功的。只是这个游戏特别的奇怪，似乎加了某种认证机制，会识别是否用了代理软件，据了解好像ss也有无法连接成功的，能连接成功的应该都是用了类似VPN的工具了，之所以开这个issues也是想看看有没了解这样问题的。如果以现在的技术无法解决的话，也只能等日后再来琢磨琢磨了。

**Comment by OneWizard** [comment]
类似情况，Cygame下的SV也有类似情况，但是ss、ssr使用正常

**Comment by guanchan** [comment]
我也遇到类似的问题，ss／ssr下，偶像大师可以进，但是vMess就是报错。我想问下题主解决这个问题了吗？可以说一下解决方案吗

**Comment by kslr** [comment]
I’m closing this issue because it has been inactive for a few months. This probably means that it is not reproducible or it has been fixed in a newer version. If it’s an enhancement and hasn’t been taken on for so long, then it seems no one has the time to implement this.

Please reopen if you still encounter this issue with the [latest stable version](https://v2ray.com/chapter_00/install.html). You can also contribute directly by providing a patch – see the [developer manual](https://v2ray.com/developer/intro/guide.html). :)

Thank you!
