### ISSUE TITLE
Socks Inbound是怎样处理DNS请求的？

### ISSUE THREAD

**Issue by yoshikotama** [v2ray/v2ray-core#727]
并不是反馈问题，只是希望有人能解决我的一个疑问，所以就先不贴配置文件了。

1. 环境配置：
我在Firefox中设置了全局socks代理并允许代理DNS请求，v2ray中设置了`geosite:cn->freedom`的规则。
2. 现象：
若访问的域名属于`geosite:cn`，则wireshark中可发现对该网站的DNS请求。若访问的域名不属于`geosite:cn`，wireshark中就不能发现对该网站的DNS请求，而v2ray的log中可见通过隧道向`8.8.8.8:53`发起的的DNS请求。
3. 问题：

- v2ray是否会提取DNS请求中的域名信息、并根据在路由表中是否有相应的记录（比如geosite:cn->freedom）选择是否将DNS请求通过隧道发送？

- 若我直接通过Socks代理向某个DNS服务器（如8.8.8.8:53）发送DNS请求，那么v2ray是否会将这个请求当作正常的UDP报文通过隧道转发，而不是根据路由策略进行处理？

- Firefox在Socks代理通道中发送的DNS请求与一般的DNS请求是否有区别？

**Comment by DarienRaymond** [comment]
对于现象的解释：
1. 当域名属于 geosite 时，DNS 请求是在 freedom 创建连接的时候发出的，所以能被 wireshark 捕获；
1. 当不属于时，猜测你的路由配置中有其它需要 IP 的路由，所以 V2Ray 进行了一次 DNS 查询；

对问题的回答：
1. 不会，只会根据DNS服务器的地址来选择是否通过隧道；
1. 会作为普通UDP数据；
1. 应该没有；

**Comment by dcliubing** [comment]
我也不知道如何配置防止DNS污染，{
          "protocol": "dokodemo-door",
          "port": 5353,
          "settings": {
             "address": "8.8.8.8",
             "port": 53,
             "network": "tcp,udp",
             "timeout": 0
          }
}
这样貌似也不行

**Comment by betterdoitnow** [comment]
@dcliubing 客户端json文件中DNS server设置为8.8.8.8，然后DNS 服务器所发出的 DNS 查询请求，会自动根据路由配置进行转发，如果你设置的是vmess转发的，那么就防污染了

**Comment by yoshikotama** [comment]
@betterdoitnow 但是这样设置之后，所有的DNS请求就都被通过隧道转发到了8.8.8.8。如果域名的所有者针对不同地域的人设置了不同的解析策略，那返回的IP地址就会是针对代理服务器的IP的解析结果。比如在使用美国服务器的情况下，淘宝就会返回淘宝美国区的页面，百度会用美国的CDN提供内容。而这种情况下就算是直连也会变得很慢。
另外，客户端具体的行为好像也与 @DarienRaymond 描述的不甚相符。我抓了一些日志，需要整理一下。晚些时候会再发上来。

**Comment by betterdoitnow** [comment]
@yoshikotama 上面已经实现了防污染。所以你的要求并不是单纯防污染，而是又想防污染又想cdn加速，你可以试试pcap_dnsproxy，可以实现你要的效果。但是有了这种DNS结果也没啥大用，关键在于v2ray的路由配置上面，我现在客户端json就配置114dns+路由域名IP白名单，114解析出来的国外IP，路由就转发了vps服务器，然后就远程解析DNS了。

**Comment by yoshikotama** [comment]
@DarienRaymond @betterdoitnow 不是防污染的问题。
我遇到的问题是，通过Actinium访问淘宝，在全局代理下会被重定向到国际版。我感觉应该是libv2ray的实现方式有问题，和v2ray本身应该没有关系。以下是我的猜测，希望大家能帮我确认一下。

环境：
- 服务器端：2.47
- PC端：2.47，传入连接使用Socks协议。
- Android端：2.50+libv2ray 25+Actinium。

下面是我的猜测。
首先，Firefox在创建连接时是直接向v2ray发送的域名，本身并没有生成DNS请求。Socks协议允许客户端建立TCP连接时直接请求域名而无须预先将域名解析成IP地址，而Firefox则完全没有参与域名的解析过程，在访问某个页面时只是把域名直接发送给了Socks服务器。真正生成DNS请求的应该是v2ray本身。V2ray将会通过路由规则来选择将DNS请求送给OS中设置的DNS服务器或v2ray的配置文件中指定的DNS服务器。

PC环境下Wireshark所获取的Socks报文如下。

```
Transmission Control Protocol, Src Port: 14696, Dst Port: 1082, Seq: 1, Ack: 1, Len: 3
Socks Protocol
    Version: 5
    Client Authentication Methods

Transmission Control Protocol, Src Port: 1082, Dst Port: 14696, Seq: 1, Ack: 4, Len: 2
Socks Protocol
    Version: 5
    Accepted Auth Method: 0x0 (No authentication)

Transmission Control Protocol, Src Port: 14696, Dst Port: 1082, Seq: 4, Ack: 3, Len: 17
Socks Protocol
    Version: 5
    Command: Connect (1)
    Reserved: 0
    Address Type: Domain Name (3)（注意这一行）
    Remote name: google.com（注意这一行）
    Port: 80

……
```

通过v2ray访问twitter和淘宝的日志输出如下（测试前已清空DNS缓存）。

```
2017/11/23 11:22:11 [Info]Proxy|Socks: TCP Connect request to tcp:twitter.com:443
2017/11/23 11:22:11 [Info]App|Router: looking up IP for tcp:twitter.com:443
2017/11/23 11:22:11 [Debug]App|DNS|Server: add pending request id 64489
2017/11/23 11:22:11 [Debug]Transport|Internet|UDP: dispatch request to: udp:8.8.8.8:53
2017/11/23 11:22:11 [Info]Transport|Internet|UDP: establishing new connection for udp:8.8.8.8:53
2017/11/23 11:22:11 [Info]App|Dispatcher|Default: default route for udp:8.8.8.8:53
2017/11/23 11:22:11 [Info]App|Proxyman|Mux: dispatching request to udp:8.8.8.8:53
2017/11/23 11:22:11 [Debug]App|DNS|Server: handling response for id 64489 content: ;; opcode: QUERY, status: NOERROR, id: 64489
;; flags: qr rd ra; QUERY: 1, ANSWER: 2, AUTHORITY: 0, ADDITIONAL: 0

;; QUESTION SECTION:
;twitter.com.   IN       A

;; ANSWER SECTION:
twitter.com.    466     IN      A       104.244.42.1
twitter.com.    466     IN      A       104.244.42.193

2017/11/23 11:22:11 [Debug]App|DNS|Server: returning 2 IPs for domain twitter.com.
2017/11/23 11:22:11 [Info]App|Dispatcher|Default: default route for tcp:twitter.com:443
2017/11/23 11:22:11 [Info]App|Proxyman|Mux: dispatching request to tcp:twitter.com:443
2017/11/23 11:22:11 [Info]Proxy|Socks: TCP Connect request to tcp:twitter.com:443
2017/11/23 11:22:11 [Info]App|Router: looking up IP for tcp:twitter.com:443
2017/11/23 11:22:11 [Info]App|Dispatcher|Default: default route for tcp:twitter.com:443
```

```
2017/11/23 11:24:06 [Info]Proxy|Socks: TCP Connect request to tcp:taobao.com:80
2017/11/23 11:24:06 [Info]App|Dispatcher|Default: taking detour [direct] for [tcp:taobao.com:80]
2017/11/23 11:24:06 [Info]Proxy|Freedom: opening connection to tcp:taobao.com:80
2017/11/23 11:24:06 [Info]Transport|Internet|TCP: dailing TCP to tcp:taobao.com:80
2017/11/23 11:24:07 [Info]Proxy|Socks: TCP Connect request to tcp:taobao.com:80
2017/11/23 11:24:07 [Info]App|Dispatcher|Default: taking detour [direct] for [tcp:taobao.com:80]
2017/11/23 11:24:07 [Info]Proxy|Freedom: opening connection to tcp:taobao.com:80
2017/11/23 11:24:07 [Info]Transport|Internet|TCP: dailing TCP to tcp:taobao.com:80
2017/11/23 11:24:07 [Info]Proxy|Socks: TCP Connect request to tcp:www.taobao.com:443
2017/11/23 11:24:07 [Info]App|Dispatcher|Default: taking detour [direct] for [tcp:www.taobao.com:443]
2017/11/23 11:24:07 [Info]Proxy|Freedom: opening connection to tcp:www.taobao.com:443
2017/11/23 11:24:07 [Info]Transport|Internet|TCP: dailing TCP to tcp:www.taobao.com:443
2017/11/23 11:24:08 [Info]Proxy|Socks: TCP Connect request to tcp:www.taobao.com:443
2017/11/23 11:24:08 [Info]App|Dispatcher|Default: taking detour [direct] for [tcp:www.taobao.com:443]
2017/11/23 11:24:08 [Info]Proxy|Freedom: opening connection to tcp:www.taobao.com:443
```

但是在Android平台上，建立TCP链接的流程与PC+Firefox+v2ray有者很大的差别。libv2ray是通过tun2socks将隧道设备转换为socks链接的，而Android OS本身依旧在按照正常的流程（DNS解析、建立连接）对外建立TCP链接，所有的DNS请求都是由OS本身发出的，v2ray本身只能将DNS报文当作普通的UDP报文、按照路由设置机械的转发。Android在建立连接时将会直接使用IP建立连接。

通过v2ray访问twitter和淘宝的日志输出如下。

```
2017/11/23 05:21:30 [Info]Proxy|Socks: client UDP connection from udp:127.0.0.1:43520
2017/11/23 05:21:30 [Debug]Proxy|Socks: send packet to udp:8.8.8.8:53 with 28 bytes
2017/11/23 05:21:30 [Debug]Transport|Internet|UDP: dispatch request to: udp:8.8.8.8:53
2017/11/23 05:21:30 [Info]Transport|Internet|UDP: establishing new connection for udp:8.8.8.8:53
2017/11/23 05:21:30 [Info]App|Dispatcher|Default: default route for udp:8.8.8.8:53
2017/11/23 05:21:30 [Info]App|Proxyman|Mux: dispatching request to udp:8.8.8.8:53
2017/11/23 05:21:30 [Info]Proxy|Socks: client UDP connection from udp:127.0.0.1:40639
2017/11/23 05:21:30 [Debug]Proxy|Socks: send packet to udp:8.8.8.8:53 with 35 bytes
2017/11/23 05:21:30 [Debug]Transport|Internet|UDP: dispatch request to: udp:8.8.8.8:53
2017/11/23 05:21:30 [Info]Transport|Internet|UDP: establishing new connection for udp:8.8.8.8:53
2017/11/23 05:21:30 [Info]App|Dispatcher|Default: default route for udp:8.8.8.8:53
2017/11/23 05:21:30 [Info]App|Proxyman|Mux: dispatching request to udp:8.8.8.8:53
2017/11/23 05:21:30 [Info]Proxy|Socks: client UDP connection from udp:127.0.0.1:42781
2017/11/23 05:21:30 [Debug]Proxy|Socks: send packet to udp:8.8.8.8:53 with 30 bytes
2017/11/23 05:21:30 [Debug]Transport|Internet|UDP: dispatch request to: udp:8.8.8.8:53
2017/11/23 05:21:30 [Info]Transport|Internet|UDP: establishing new connection for udp:8.8.8.8:53
2017/11/23 05:21:30 [Info]App|Dispatcher|Default: default route for udp:8.8.8.8:53
2017/11/23 05:21:30 [Info]App|Proxyman|Mux: dispatching request to udp:8.8.8.8:53
2017/11/23 05:21:30 [Info]Proxy|Socks: client UDP connection from udp:127.0.0.1:57163
2017/11/23 05:21:30 [Debug]Proxy|Socks: send packet to udp:8.8.8.8:53 with 32 bytes
2017/11/23 05:21:30 [Debug]Transport|Internet|UDP: dispatch request to: udp:8.8.8.8:53
2017/11/23 05:21:30 [Info]Transport|Internet|UDP: establishing new connection for udp:8.8.8.8:53
2017/11/23 05:21:30 [Info]App|Dispatcher|Default: default route for udp:8.8.8.8:53
2017/11/23 05:21:30 [Info]App|Proxyman|Mux: dispatching request to udp:8.8.8.8:53
2017/11/23 05:21:30 [Debug]Proxy|Socks: writing back UDP response with 60 bytes
2017/11/23 05:21:30 [Info]Proxy|Socks: TCP Connect request to tcp:140.205.94.189:80
2017/11/23 05:21:30 [Debug]Proxy|Socks: writing back UDP response with 92 bytes
2017/11/23 05:21:30 [Debug]Proxy|Socks: writing back UDP response with 99 bytes
2017/11/23 05:21:30 [Debug]Proxy|Socks: writing back UDP response with 109 bytes
2017/11/23 05:21:30 [Info]Proxy|Socks: TCP Connect request to tcp:202.47.28.119:443
2017/11/23 05:21:30 [Info]App|Dispatcher|Default: sniffed domain: taobao.com
2017/11/23 05:21:30 [Info]App|Dispatcher|Default: taking detour [direct] for [tcp:taobao.com:80]
2017/11/23 05:21:30 [Info]Proxy|Freedom: opening connection to tcp:taobao.com:80
2017/11/23 05:21:30 [Info]Transport|Internet|TCP: dailing TCP to tcp:taobao.com:80
2017/11/23 05:21:30 [Info]Proxy|Socks: client UDP connection from udp:127.0.0.1:43903
2017/11/23 05:21:30 [Debug]Proxy|Socks: send packet to udp:8.8.8.8:53 with 28 bytes
2017/11/23 05:21:30 [Debug]Transport|Internet|UDP: dispatch request to: udp:8.8.8.8:53
2017/11/23 05:21:30 [Info]Transport|Internet|UDP: establishing new connection for udp:8.8.8.8:53
2017/11/23 05:21:30 [Info]App|Dispatcher|Default: default route for udp:8.8.8.8:53
2017/11/23 05:21:30 [Info]App|Proxyman|Mux: dispatching request to udp:8.8.8.8:53
2017/11/23 05:21:30 [Info]Proxy|Socks: TCP Connect request to tcp:202.47.28.119:80
2017/11/23 05:21:30 [Info]Proxy|Socks: TCP Connect request to tcp:202.47.28.119:443
2017/11/23 05:21:30 [Info]Proxy|Socks: TCP Connect request to tcp:47.89.66.254:443
2017/11/23 05:21:30 [Info]Proxy|Socks: TCP Connect request to tcp:202.47.28.119:443
2017/11/23 05:21:30 [Info]Proxy|Socks: TCP Connect request to tcp:47.89.66.254:443
2017/11/23 05:21:31 [Info]App|Dispatcher|Default: sniffed domain: m.taobao.com
2017/11/23 05:21:31 [Info]App|Dispatcher|Default: taking detour [direct] for [tcp:m.taobao.com:443]
2017/11/23 05:21:31 [Info]Proxy|Freedom: opening connection to tcp:m.taobao.com:443
2017/11/23 05:21:31 [Info]Transport|Internet|TCP: dailing TCP to tcp:m.taobao.com:443
………………
2017/11/23 05:21:38 [Info]Proxy|Socks: TCP Connect request to tcp:202.47.28.119:443
2017/11/23 05:21:38 [Info]Proxy|Socks: client UDP connection from udp:127.0.0.1:55957
2017/11/23 05:21:38 [Debug]Proxy|Socks: send packet to udp:8.8.8.8:53 with 19 bytes
2017/11/23 05:21:38 [Debug]Transport|Internet|UDP: dispatch request to: udp:8.8.8.8:53
2017/11/23 05:21:38 [Info]Transport|Internet|UDP: establishing new connection for udp:8.8.8.8:53
2017/11/23 05:21:38 [Info]App|Dispatcher|Default: default route for udp:8.8.8.8:53
2017/11/23 05:21:38 [Info]App|Proxyman|Mux: dispatching request to udp:8.8.8.8:53
2017/11/23 05:21:38 [Info]App|Dispatcher|Default: sniffed domain: m.intl.taobao.com
2017/11/23 05:21:38 [Info]App|Dispatcher|Default: taking detour [direct] for [tcp:m.intl.taobao.com:443]
2017/11/23 05:21:38 [Info]Proxy|Freedom: opening connection to tcp:m.intl.taobao.com:443
2017/11/23 05:21:38 [Info]Transport|Internet|TCP: dailing TCP to tcp:m.intl.taobao.com:443
```

```
2017/11/23 04:47:54 [Info]Proxy|Socks: client UDP connection from udp:127.0.0.1:35010
2017/11/23 04:47:54 [Info]Transport|Internet|UDP: establishing new connection for udp:8.8.8.8:53
2017/11/23 04:47:54 [Info]App|Dispatcher|Default: default route for udp:8.8.8.8:53
2017/11/23 04:47:54 [Info]App|Proxyman|Mux: dispatching request to udp:8.8.8.8:53
2017/11/23 04:47:54 [Info]Proxy|Socks: TCP Connect request to tcp:104.244.42.65:443
2017/11/23 04:47:54 [Info]Proxy|Socks: TCP Connect request to tcp:104.244.42.65:443
2017/11/23 04:47:54 [Info]Proxy|Socks: TCP Connect request to tcp:104.244.42.65:443
2017/11/23 04:47:54 [Info]Proxy|Socks: TCP Connect request to tcp:104.244.42.65:443
2017/11/23 04:47:54 [Info]App|Dispatcher|Default: sniffed domain: twitter.com
2017/11/23 04:47:54 [Info]App|Router: looking for IP for domain: twitter.com
2017/11/23 04:47:54 [Info]App|Dispatcher|Default: default route for tcp:twitter.com:443
2017/11/23 04:47:54 [Info]App|Proxyman|Mux: dispatching request to tcp:twitter.com:443
2017/11/23 04:47:54 [Info]App|Dispatcher|Default: sniffed domain: twitter.com
2017/11/23 04:47:54 [Info]App|Dispatcher|Default: sniffed domain: twitter.com
2017/11/23 04:47:54 [Info]App|Router: looking for IP for domain: twitter.com
2017/11/23 04:47:54 [Info]App|Router: looking for IP for domain: twitter.com
2017/11/23 04:47:54 [Info]App|Dispatcher|Default: default route for tcp:twitter.com:443
2017/11/23 04:47:54 [Info]App|Proxyman|Mux: dispatching request to tcp:twitter.com:443
2017/11/23 04:47:54 [Info]App|Router: looking for IP for domain: twitter.com
2017/11/23 04:47:54 [Info]App|Dispatcher|Default: default route for tcp:twitter.com:443
2017/11/23 04:47:54 [Info]App|Proxyman|Mux: dispatching request to tcp:twitter.com:443
2017/11/23 04:47:54 [Info]Transport|Internet|WebSocket: creating connection to tcp:wodeipdizhi:80
2017/11/23 04:47:55 [Info]Proxy|VMess|Outbound: tunneling request to tcp:v1.mux.cool:9527 via tcp:wodeipdizhi:80
```

因此v2ray在这个情况下就不能将域名与按照路由规则送给不同的服务器解析。如果DNS设置为海外的服务器就会导致淘宝返回海外版页面。即使是设置了domainOverride也只能是在建立连接时再通过嗅探选择直连或走隧道，无法解决问题。

Android端配置文件

```
{
  "port": 10808,
  "log": {
    "loglevel": "debug"
  },
  "inbound": {
    "domainOverride": [
        "http",
        "tls"
    ],
    "listen": "127.0.0.1",
    "protocol": "socks",
    "settings": {
      "auth": "noauth",
      "udp": true
    },
    "allowPassive": true
  },
  "inboundDetour": [
    {
      "protocol": "http",
      "port": 10845,
      "settings": {},
      "listen": "127.0.0.1"
    },
    {
      "protocol": "dokodemo-door",
      "port": 10846,
      "listen": "0.0.0.0",
      "settings": {
        "network": "tcp",
        "timeout": 0,
        "followRedirect": true
      }
    }
  ],
  "outbound": {
    "protocol": "vmess",
    "settings": {
      "vnext": [
        {
          "address": "<ws.address>",
          "port": <ws.port>,
          "users": [
            {
              "id": "<id>",
              "alterId": 64,
              "security": "auto"
            }
          ]
        }
      ]
    },
    "mux":{
      "enabled":true
    }
  },
  "outboundDetour": [
    {
      "protocol": "freedom",
      "settings": {},
      "tag": "direct"
    }
  ],
  "dns": {
    "servers": [
      "8.8.8.8",
      "8.8.4.4",
      "localhost"
    ]
  },
  "routing": {
    "strategy": "rules",
    "settings": {
      "domainStrategy": "IPIfNonMatch",
      "rules": [
        {
          "type": "field",
          "port": "1-52",
          "outboundTag": "direct"
        },
        {
          "type": "field",
          "port": "54-79",
          "outboundTag": "direct"
        },
        {
          "type": "field",
          "port": "81-442",
          "outboundTag": "direct"
        },
        {
          "type": "field",
          "port": "444-65535",
          "outboundTag": "direct"
        },
        {
          "type": "field",
          "domain": ["geosite:cn"],
          "outboundTag": "direct"
        },
        {
          "type": "field",
          "ip": [
            "0.0.0.0/8",
            "10.0.0.0/8",
            "100.64.0.0/10",
            "127.0.0.0/8",
            "169.254.0.0/16",
            "172.16.0.0/12",
            "192.0.0.0/24",
            "192.0.2.0/24",
            "192.168.0.0/16",
            "198.18.0.0/15",
            "198.51.100.0/24",
            "203.0.113.0/24",
            "::1/128",
            "fc00::/7",
            "fe80::/10",
            "geoip:cn"
          ],
          "outboundTag": "direct"
        }
      ]
    }
  },
  "transport": {},
  "#lib2ray": {
    "enabled": true,
    "listener": {
      "onUp": "#none",
      "onDown": "#none"
    },
    "env": [
      "V2RayDNSPort=5353",
      "DNSForwardingProxyPort=5350",
      "V2RaySocksPort=10808"
    ],
    "render": [],
    "escort": [],
    "vpnservice": {
      "Target": "${datadir}tun2socks",
      "Args": [
        "--netif-ipaddr",
        "26.26.26.2",
        "--netif-netmask",
        "255.255.255.0",
        "--socks-server-addr",
        "127.0.0.1:$V2RaySocksPort",
        "--tunfd",
        "3",
        "--tunmtu",
        "1500",
        "--sock-path",
        "/dev/null",
        "--loglevel",
        "4",
        "--enable-udprelay"
      ],
      "VPNSetupArg": "m,1500 a,26.26.26.1,24 r,0.0.0.0,0 d,208.67.222.222"
    },
    "preparedDomainName": {
      "domainName": [
        "<ws.address>:<ws.port>"
      ],
      "tcpVersion": "tcp4",
      "udpVersion": "udp4"
    }
  }
}
```

PC端配置文件

```
{
  "log": {
    "loglevel": "debug"
  },
  "inbound": {
    "port": 1082,
    "listen": "127.0.0.1",
    "protocol": "socks",
    "settings": {
      "auth": "noauth",
      "udp": true,
      "ip": "127.0.0.1",
      "timeout": 0
    
    }
  },
  "outbound": {
    "protocol": "vmess",
    "settings": {
      "vnext": [
        {
          "address": "<ws.address>",
          "port": <ws.port>,
          "users": [
            {
              "id": "<id>",
              "alterId": 64,
              "security": "auto"
            }
          ]
        }
      ]
    },
    "mux":{
      "enabled":true
    }
  },
  "outboundDetour": [
    {
      "protocol": "freedom",
      "settings": {},
      "tag": "direct"
    }
  ],
  "dns": {
    "servers": [
      "8.8.8.8",
      "8.8.4.4",
      "localhost"
    ]
  },
  "routing": {
    "strategy": "rules",
    "settings": {
      "domainStrategy": "IPIfNonMatch",
      "rules": [
        {
          "type": "field",
          "port": "1-52",
          "outboundTag": "direct"
        },
        {
          "type": "field",
          "port": "54-79",
          "outboundTag": "direct"
        },
        {
          "type": "field",
          "port": "81-442",
          "outboundTag": "direct"
        },
        {
          "type": "field",
          "port": "444-65535",
          "outboundTag": "direct"
        },
        {
          "type": "field",
          "domain": ["geosite:cn"],
          "outboundTag": "direct"
        },
        {
          "type": "field",
          "ip": [
            "0.0.0.0/8",
            "10.0.0.0/8",
            "100.64.0.0/10",
            "127.0.0.0/8",
            "169.254.0.0/16",
            "172.16.0.0/12",
            "192.0.0.0/24",
            "192.0.2.0/24",
            "192.168.0.0/16",
            "198.18.0.0/15",
            "198.51.100.0/24",
            "203.0.113.0/24",
            "::1/128",
            "fc00::/7",
            "fe80::/10",
            "geoip:cn"
          ],
          "outboundTag": "direct"
        }
      ]
    }
  }
}
```
(两者的路由、DNS、传出规则都是一致的）

**Comment by DarienRaymond** [comment]
从你贴的日志看 taobao.com 的确是直连的没有错。可能 taobao 有另外的域名没有被加进 chinasites，从而导致taobao转到了国际版，你可以仔细看一下log，把那些域名手动调整一下路由。

```
2017/11/23 05:21:30 [Info]Proxy|Socks: TCP Connect request to tcp:202.47.28.119:443
2017/11/23 05:21:30 [Info]App|Dispatcher|Default: sniffed domain: taobao.com
2017/11/23 05:21:30 [Info]App|Dispatcher|Default: taking detour [direct] for [tcp:taobao.com:80]
2017/11/23 05:21:30 [Info]Proxy|Freedom: opening connection to tcp:taobao.com:80
2017/11/23 05:21:30 [Info]Transport|Internet|TCP: dailing TCP to tcp:taobao.com:80
```

**Comment by daiaji** [comment]
@betterdoitnow  @DarienRaymond chinaDNS那边报过说是DNS投毒有时候会回报国内IP 这就很囧了
就不能正常工作了 现在甚至没法用chinaDNS （没法设置非53端口的DNS不是吗？
然后我这边有个很奇怪的VPS
pixiv.net屏蔽了我的VPS
而且pixiv.net虽然被DNS投毒了
但是IP没封 
所以我只需要正确的DNS解析就OK了
但是设置                    
```
"domain":[
    "pixiv.net",
    "geosite:cn"
],
```
的话似乎是直接用本地的DNS解析无视了v2ray的DNS设置
并且设置
```
    "dns":{
        "servers":[
            "208.67.220.220"
        ]
    },
```
之后
baidu似乎被解析到国外服务器上去了
真是个悲伤的故事……

**Comment by daiaji** [comment]
@DarienRaymond 我在客户端这边用了这个配置 看起来如果路由指定某些域名直连的话 是不会用dns段里的服务器解析的 
那么我只想做pixiv.net的远程DNS解析的话就做不到吧
只能先自行解析pixiv.net的IP然后填到直连的IP段里？
好麻烦啊……
```
{
    "inbound":{
        "port":1080,
        "protocol":"socks",
        "settings":{
            "auth":"noauth"
        }
    },
    "outbound":{
        "protocol":"vmess",
        "settings":{
            "vnext":[
                {
                    "address":"*************",
                    "port":443,
                    "users":[
                        {
                            "id":"****************************",
                            "alterId":64
                        }
                    ]
                }
            ]
        },
        "streamSettings":{
            "network":"ws",
            "security":"tls"
        }
    },
    "outboundDetour":[
        {
            "protocol":"freedom",
            "settings":{

            },
            "tag":"direct"
        }
    ],
    "routing":{
        "strategy":"rules",
        "settings":{
            "domainStrategy":"IPIfNonMatch",
            "rules":[
                {
                    "type":"field",
                    "domain":[
                        "pixiv.net",
                        "geosite:cn"
                    ],
                    "ip":[
                        "0.0.0.0/8",
                        "10.0.0.0/8",
                        "100.64.0.0/10",
                        "127.0.0.0/8",
                        "169.254.0.0/16",
                        "172.16.0.0/12",
                        "192.0.0.0/24",
                        "192.0.2.0/24",
                        "192.168.0.0/16",
                        "198.18.0.0/15",
                        "198.51.100.0/24",
                        "203.0.113.0/24",
                        "::1/128",
                        "fc00::/7",
                        "fe80::/10",
                        "geoip:cn"
                    ],
                    "outboundTag":"direct"
                }
            ]
        }
    },
    "dns":{
        "servers":[
            "208.67.220.220"
        ]
    },
    "transport":{
        "kcpSettings":{
            "congestion":true
        }
    }
}
```

**Comment by betterdoitnow** [comment]
@daiaji 在json文件中的DNS配置只为v2ray内部的路由服务，也就是说，在需要的时候v2ray通过内置dns服务器解析到相应的IP然后判断需要走哪条路由路径...
所以你的问题在于获得一个纯净的pixiv的IP，然后直连.. 另外你不想用国外的dns解析（不想牺牲国内网站访问的速度），简单点你可以 你可以考虑直接hosts写入啊pixiv的IP，复杂点你要去好好研究类似pcap_dnsproxy之类的了

**Comment by daiaji** [comment]
@betterdoitnow  嗯 我原来寻思着用chinadns解决问题 但是似乎v2不能设非53端口的dns 可能要把本机的dns设成chinadns 就是pixiv也不止一个ip所以设hosts太麻烦了😂

**Comment by xiaokangwang** [comment]
和 https://github.com/xiaokangwang/AndroidLibV2ray/issues/20 重复。
可以合并讨论

**Comment by DarienRaymond** [comment]
* 如果你要加一个 DNS 分流的功能，可以在 Planning 里面提一个 issue，在 domainOverride 里加入对 DNS 消息的识别
* 从 V2Ray 的角度来说，V2Ray 不负责判断对和错，即 V2Ray 可以用来阻止 DNS 污染，但实际上有没有 DNS 污染，V2Ray 并不关心。配置合理的网络环境以达到最优的上网效果，是用户的义务。
